{
  "schemaVersion": 1,
  "catalogVersion": "2026.07.01-1",
  "updatedAt": "2026-07-01T21:47:50Z",
  "categories": [
    {
      "id": "browsers",
      "name": "Browsers",
      "icon": "globe",
      "order": 1
    },
    {
      "id": "communication",
      "name": "Communication",
      "icon": "message-circle",
      "order": 2
    },
    {
      "id": "games-launchers",
      "name": "Games & Launchers",
      "icon": "gamepad-2",
      "order": 3
    },
    {
      "id": "video-recording",
      "name": "Video & Audio",
      "icon": "clapperboard",
      "order": 4
    },
    {
      "id": "productivity",
      "name": "Productivity",
      "icon": "notebook-pen",
      "order": 5
    },
    {
      "id": "developer-tools",
      "name": "Developer Tools",
      "icon": "terminal",
      "order": 6
    }
  ],
  "apps": [
    {
      "id": "google-chrome",
      "name": "Google Chrome",
      "shortDescription": "Google's fast, widely used web browser",
      "description": "The world's most widely used web browser. Syncs bookmarks, passwords, and tabs across devices with a Google account, and supports a large extension ecosystem.",
      "category": "browsers",
      "homepage": "https://www.google.com/chrome/",
      "license": "Proprietary",
      "icon": "icons/google-chrome.png",
      "tags": [
        "browser",
        "web",
        "google",
        "sync"
      ],
      "featured": true,
      "popularity": 100,
      "sources": {
        "windows": [
          {
            "manager": "winget",
            "id": "Google.Chrome",
            "official": true
          }
        ],
        "macos": [
          {
            "manager": "brew-cask",
            "id": "google-chrome",
            "official": true
          }
        ],
        "linux": [
          {
            "manager": "flatpak",
            "id": "com.google.Chrome",
            "official": false,
            "note": "Flathub listing exists but is a community-maintained wrapper, not verified by or affiliated with Google."
          }
        ]
      }
    },
    {
      "id": "firefox",
      "name": "Firefox",
      "shortDescription": "Open-source browser from Mozilla",
      "description": "Mozilla's free and open-source web browser, focused on privacy and standards compliance. The main independent alternative to Chromium-based browsers.",
      "category": "browsers",
      "homepage": "https://www.mozilla.org/firefox/",
      "license": "MPL-2.0",
      "icon": "icons/firefox.png",
      "tags": [
        "browser",
        "web",
        "open-source",
        "privacy"
      ],
      "featured": true,
      "popularity": 88,
      "sources": {
        "windows": [
          {
            "manager": "winget",
            "id": "Mozilla.Firefox",
            "official": true
          }
        ],
        "macos": [
          {
            "manager": "brew-cask",
            "id": "firefox",
            "official": true
          }
        ],
        "linux": [
          {
            "manager": "flatpak",
            "id": "org.mozilla.firefox",
            "official": true,
            "note": "Official Mozilla-verified Flathub listing."
          }
        ]
      }
    },
    {
      "id": "brave",
      "name": "Brave",
      "shortDescription": "Privacy-focused browser with built-in ad blocking",
      "description": "A Chromium-based browser that blocks ads and trackers by default. Includes optional crypto wallet and rewards features, with Chrome extension compatibility.",
      "category": "browsers",
      "homepage": "https://brave.com/",
      "license": "MPL-2.0",
      "icon": "icons/brave.png",
      "tags": [
        "browser",
        "web",
        "privacy",
        "ad-blocking",
        "chromium"
      ],
      "featured": false,
      "popularity": 70,
      "sources": {
        "windows": [
          {
            "manager": "winget",
            "id": "Brave.Brave",
            "official": true
          }
        ],
        "macos": [
          {
            "manager": "brew-cask",
            "id": "brave-browser",
            "official": true
          }
        ],
        "linux": [
          {
            "manager": "flatpak",
            "id": "com.brave.Browser",
            "official": true,
            "note": "Verified publisher (Brave Software) on Flathub."
          }
        ]
      }
    },
    {
      "id": "vivaldi",
      "name": "Vivaldi",
      "shortDescription": "Highly customizable browser with built-in tools",
      "description": "A Chromium-based browser for power users, with deep UI customization, tab stacking, and built-in email client, notes, and ad blocker.",
      "category": "browsers",
      "homepage": "https://vivaldi.com/",
      "license": "Proprietary",
      "icon": "icons/vivaldi.png",
      "tags": [
        "browser",
        "web",
        "customization",
        "power-user",
        "chromium"
      ],
      "featured": false,
      "popularity": 45,
      "sources": {
        "windows": [
          {
            "manager": "winget",
            "id": "Vivaldi.Vivaldi",
            "official": true
          }
        ],
        "macos": [
          {
            "manager": "brew-cask",
            "id": "vivaldi",
            "official": true
          }
        ],
        "linux": [
          {
            "manager": "flatpak",
            "id": "com.vivaldi.Vivaldi",
            "official": false,
            "note": "Flathub listing exists but is community-maintained and not yet officially endorsed or supported by Vivaldi Technologies."
          }
        ]
      }
    },
    {
      "id": "discord",
      "name": "Discord",
      "shortDescription": "Voice, video, and text chat for communities",
      "description": "Chat app built around servers and channels, with voice rooms, video calls, and screen sharing. Widely used by gaming groups, open-source projects, and online communities.",
      "category": "communication",
      "homepage": "https://discord.com/",
      "license": "Proprietary",
      "icon": "icons/discord.png",
      "tags": [
        "chat",
        "voice",
        "video",
        "communities",
        "gaming"
      ],
      "featured": true,
      "popularity": 92,
      "sources": {
        "windows": [
          {
            "manager": "winget",
            "id": "Discord.Discord",
            "official": true
          }
        ],
        "macos": [
          {
            "manager": "brew-cask",
            "id": "discord",
            "official": true
          }
        ],
        "linux": [
          {
            "manager": "flatpak",
            "id": "com.discordapp.Discord",
            "official": true,
            "note": "Publisher-verified on Flathub (website verification via discordapp.com)."
          }
        ]
      }
    },
    {
      "id": "zoom",
      "name": "Zoom",
      "shortDescription": "Video meetings, webinars, and screen sharing",
      "description": "Video conferencing app for meetings, webinars, and screen sharing. Common default for work calls, remote classes, and large online events.",
      "category": "communication",
      "homepage": "https://zoom.us/",
      "license": "Proprietary",
      "icon": "icons/zoom.png",
      "tags": [
        "video-calls",
        "meetings",
        "webinars",
        "screen-sharing"
      ],
      "featured": true,
      "popularity": 90,
      "sources": {
        "windows": [
          {
            "manager": "winget",
            "id": "Zoom.Zoom",
            "official": true,
            "note": "Still published as Zoom.Zoom despite the Zoom Workplace rebrand; no separate ZoomWorkplace package exists under the Zoom publisher."
          }
        ],
        "macos": [
          {
            "manager": "brew-cask",
            "id": "zoom",
            "official": true
          }
        ],
        "linux": [
          {
            "manager": "flatpak",
            "id": "us.zoom.Zoom",
            "official": false,
            "note": "Community-maintained wrapper; Flathub listing states it is not verified by or affiliated with zoom.us."
          }
        ]
      }
    },
    {
      "id": "slack",
      "name": "Slack",
      "shortDescription": "Team messaging organized into channels",
      "description": "Workplace messaging app with channels, threads, huddles, and file sharing. The standard team chat tool at many companies, with a large ecosystem of integrations.",
      "category": "communication",
      "homepage": "https://slack.com/",
      "license": "Proprietary",
      "icon": "icons/slack.png",
      "tags": [
        "chat",
        "teams",
        "work",
        "collaboration"
      ],
      "featured": false,
      "popularity": 88,
      "sources": {
        "windows": [
          {
            "manager": "winget",
            "id": "SlackTechnologies.Slack",
            "official": true
          }
        ],
        "macos": [
          {
            "manager": "brew-cask",
            "id": "slack",
            "official": true
          }
        ],
        "linux": [
          {
            "manager": "flatpak",
            "id": "com.slack.Slack",
            "official": false,
            "note": "Community-maintained wrapper; Flathub listing states it is not verified by or affiliated with Slack Technologies. Slack for Linux is beta."
          }
        ]
      }
    },
    {
      "id": "signal",
      "name": "Signal",
      "shortDescription": "Private, end-to-end encrypted messaging",
      "description": "Messaging app with end-to-end encryption on by default for texts, calls, and file sharing. Run by a nonprofit; the desktop app links to Signal on your phone.",
      "category": "communication",
      "homepage": "https://signal.org/",
      "license": "AGPL-3.0-only",
      "icon": "icons/signal.png",
      "tags": [
        "chat",
        "privacy",
        "encryption",
        "messaging"